{
  "scenario_id":"V4L04B-constraint-casebook","measurements":{
    "N01":{"value":"50","unit":"records"},"N02":{"value":"33","unit":"records"},"N03":{"value":"13","unit":"records"},"N04":{"value":"11","unit":"ticks"},"N05":{"value":"5","unit":"items"},"N06":{"value":"4","unit":"evictions"},"N07":{"value":"5","unit":"promotions"},"N08":{"value":"5","unit":"items"},"N09":{"value":"8","unit":"selections"},"N10":{"value":"65","unit":"utility-points"},"N11":{"value":"1","unit":"selections"},"N12":{"value":"22","unit":"cost-credits"},"N13":{"value":"6","unit":"mutations"},"N14":{"value":"3","unit":"items"},
    "W01":{"value":"1","unit":"units"},"W02":{"value":"2","unit":"units"},"W03":{"value":"0","unit":"units"},"W04":{"value":"2","unit":"units"},"T01":{"value":"91","unit":"utility-points"},"T02":{"value":"3","unit":"utility-points"}
  },"cases":{
    "I01":{"value":"holds","unit":"enum"},"I02":{"value":"holds","unit":"enum"},"I03":{"value":"holds","unit":"enum"},"I04":{"value":"holds","unit":"enum"},"I05":{"value":"violated","unit":"enum"},"I06":{"value":"holds","unit":"enum"},
    "F01":{"value":"BF01-A","unit":"case-id"},"F02":{"value":"BF02-B","unit":"case-id"},"F03":{"value":"BF03-C","unit":"case-id"},"F04":{"value":"BL-04","unit":"step-id"},"F05":{"value":"BF05-B","unit":"case-id"}
  },"narrative":"Exact numeric values serialized as strings."
}
